{
  "schema": "mektup/control/v1",
  "kind": "result",
  "operation": "originalStatus",
  "operationId": "op_0198f0e0-0000-7000-8000-000000000031",
  "originalMessageId": "msg_0198f0e0-0000-7000-8000-000000000003",
  "custody": {
    "endpointId": "ep_0198f0e0-0000-7000-8000-000000000001",
    "storeId": "store_0198f0e0-0000-7000-8000-000000000002"
  },
  "replyDestination": {
    "endpointId": "ep_0198f0e0-0000-7000-8000-000000000001",
    "threadId": "thread-local-001",
    "uri": "codex://local/thread/thread-local-001"
  },
  "result": {
    "selection": "terminal_unknown",
    "state": "reply_outcome_unknown",
    "replyMessageId": "msg_0198f0e0-0000-7000-8000-000000000007",
    "replyStatus": "error",
    "replyErrorCode": "reply_rejected",
    "bodyBytes": 9,
    "bodySha256": "sha256:bbbbbbbbbbbbbbbbbbbbbbbbbbbbbbbbbbbbbbbbbbbbbbbbbbbbbbbbbbbbbbbb",
    "eventSeq": 4
  }
}
